{
  "manifest_id": "rm-0001",
  "release_id": "rel-0001",
  "version": "0.0.0-alpha.0",
  "artifacts": [
    {
      "name": "atom-core",
      "digest": "sha256:aaaaaaaaaaaaaaaaaaaaaaaaaaaaaaaaaaaaaaaaaaaaaaaaaaaaaaaaaaaaaaaa"
    }
  ],
  "created_at": "2026-08-31T12:00:00Z",
  "signatures": [
    "sig:v1"
  ],
  "notes": null
}
